{
  "$schema": "https://json-schema.org/draft/2020-12/schema",
  "$id": "https://patent-docent.local/contracts/schemas/metrics-row.schema.json",
  "title": "metrics-row/v0",
  "$comment": "지표 원장 1행(ledgers/metrics.jsonl, JSONL 1행 1레코드). 근거 = 헌장 D13(개정) + Owner 재정 2026-08-17 R12. ★ 규율: (1) 추가 전용(append-only) — 기존 행의 바이트를 수정하지 않는다. 오기는 entry_kind: \"correction\" 행을 추가해 정정하며 corrects 에 원 행 id 를 적는다. 검사 feedback.ledger-append-only 가 이전 행들의 바이트 불변을 확인하고 위반 시 halt 한다. (2) 원시 전량 영구 보존 — 절대량 필드(impressions·likes·reposts·quotes·bookmarks·replies)를 허용한다. 구 D13 의 '원시 조회수 금지' 조항은 폐기되었다. (3) 자동 정규화(백분위·이동 중앙값) 필드는 v1 에 두지 않는다. 시대 드리프트가 실측되면 배치 리뷰 상신으로 도입하며, 원시 보존이 소급 재계산을 보장한다. (4) 72h 스냅샷은 필수이고 ±12h 창을 벗어나면 within_window: false 로 기록하되 폐기하지 않는다. 168h(7일) 스냅샷은 선택이며 창 폭은 **±24h** 다(재정 P-7 — 72h/±12h 에 대한 비례 근거). 창 밖 기록은 폐기하지 않고 within_window: false + non_standard_window: true 로 **보존**하되 표준 통계에서 제외한다. 선택 스냅샷을 뜨지 못한 경우는 행을 없애지 않고 collection_state: \"not-collected\"(**미수집**)로 적는다 — 미수집은 결측·공허와 다른 어휘다: 결측은 있어야 할 값이 사라진 것이고 공허는 검사가 아무것도 세지 않은 것이지만, 미수집은 **뜨지 않기로 한 관측**이다. 셋을 한 어휘로 뭉개면 '왜 이 수치가 없는가'를 사후에 되짚을 수 없다. (5) v1 수집은 수동 입력이며 시스템은 입력 템플릿(90-feedback/metrics-input-template.md)만 제시한다. (6) 지표는 게이트가 아니다 — 출하물의 소급 판정을 바꾸지 않으며, 환류는 배치 리뷰 재정을 거쳐서만 생성계에 도달한다. ★ 스키마로 표현하지 않고 검증기에 맡기는 제약(재감수 M-05): (a) completion_proxy 가 landing.impressions / hook.impressions 와 실제로 일치하는지(분모 0 이면 null) — 스키마는 부호와 타입만 막는다. 검사 id = feedback.row-consistency. (b) corrects 가 가리키는 row_id 가 원장 안에 실재하는지 — 행 1건의 스키마 밖이므로 원장 전체를 읽는 검사가 해소한다. 검사 id = feedback.corrects-resolve. ★ 해소된 미재정 잔여: window_h == 168 의 창 폭은 **재정 P-7 로 ±24h 확정**되었고, 그에 따라 168 행에도 within_window 등가 검사를 건다. 구 규율(\"창 폭 미재정이므로 168 행의 within_window 는 입력자 신고값\")은 **폐기**한다 — 신고값 자리는 남지 않는다.",
  "type": "object",
  "additionalProperties": false,
  "required": ["schema", "row_id", "entry_kind", "corrects", "run_id", "variant", "thread_url", "posted_at", "snapshot", "hook", "landing", "completion_proxy", "context", "entered_by", "entered_at"],
  "properties": {
    "schema": { "const": "metrics-row/v0" },
    "row_id": { "$ref": "#/$defs/row_id" },
    "entry_kind": { "enum": ["record", "correction"] },
    "corrects": {
      "oneOf": [{ "$ref": "#/$defs/row_id" }, { "type": "null" }]
    },
    "run_id": { "type": "string", "minLength": 1 },
    "variant": { "type": "string", "pattern": "^v[0-9]+$" },
    "thread_url": { "type": "string", "minLength": 1 },
    "posted_at": { "$ref": "#/$defs/timestamp" },
    "snapshot": {
      "$comment": "M-05b 집행: within_window 는 신고값이 아니라 offset_h 의 함수다. |offset_h| <= 12 ⟺ within_window == true 를 72h 행에 양방향으로 강제하고, **168h 행에는 같은 등가를 ±24h 로 건다**(재정 P-7 — 창 폭이 확정되어 구 '신고값' 자리가 사라졌다). ★ 등가 강제는 collection_state == \"collected\" 인 행에서만 성립한다 — 뜨지 않은 관측에는 시각도 편차도 없기 때문이다. 미수집 행은 taken_at·offset_h·within_window 를 전부 null 로 적는다: 0 이나 false 로 적으면 '정시에 떴다'·'창을 벗어났다'는 관측 주장이 되어 표준 통계에 섞인다.",
      "type": "object",
      "additionalProperties": false,
      "required": ["window_h", "taken_at", "within_window", "offset_h", "collection_state", "non_standard_window"],
      "properties": {
        "window_h": { "enum": [72, 168] },
        "taken_at": { "oneOf": [{ "$ref": "#/$defs/timestamp" }, { "type": "null" }] },
        "within_window": { "type": ["boolean", "null"] },
        "offset_h": { "type": ["number", "null"] },
        "collection_state": {
          "$comment": "스냅샷을 실제로 떴는가 (재정 P-7). collected = 관측이 있다. not-collected = **미수집** — 선택 스냅샷(168h)을 뜨지 않은 경우의 자리이며, 행을 지우는 대신 '뜨지 않았다'를 명시적으로 적는다. 어휘 구별은 규율 (4) 참조(결측·공허와 다르다). ★ 72h 는 필수 스냅샷이므로 not-collected 는 원장 층의 이상 신호이지만, 이 스키마는 그것을 막지 않는다 — 놓친 관측을 적을 자리가 없으면 원장이 사실 대신 침묵을 담는다. 그 이상 판정은 원장 전체를 읽는 검증기 몫이다.",
          "enum": ["collected", "not-collected"]
        },
        "non_standard_window": {
          "$comment": "비표준 시점 표시 (재정 P-7). 창 밖 기록을 **폐기하지 않고** 보존하되 표준 통계에서 제외하기 위한 표지이며, collected 행에서 within_window 의 반대값이다(아래 allOf 가 양방향으로 묶는다). 파생값을 굳이 필드로 세우는 이유: 통계를 거르는 쪽이 within_window 의 의미를 다시 해석하지 않게 하려는 것이다 — '창 밖'과 '제외 대상'을 같은 이름으로 부르면 나중에 창을 재정으로 조정할 때 어느 쪽 뜻이었는지가 흐려진다. 미수집 행은 관측 자체가 없으므로 false 다(제외할 표준 통계 기여분이 애초에 없다).",
          "type": "boolean"
        }
      },
      "allOf": [
        {
          "$comment": "collected 행은 관측 3필드를 실값으로 갖는다.",
          "if": {
            "required": ["collection_state"],
            "properties": { "collection_state": { "const": "collected" } }
          },
          "then": {
            "properties": {
              "taken_at": { "type": "string" },
              "within_window": { "type": "boolean" },
              "offset_h": { "type": "number" }
            }
          }
        },
        {
          "$comment": "미수집 행은 관측 3필드가 전부 null 이고 비표준 시점 표지도 서지 않는다.",
          "if": {
            "required": ["collection_state"],
            "properties": { "collection_state": { "const": "not-collected" } }
          },
          "then": {
            "properties": {
              "taken_at": { "type": "null" },
              "within_window": { "type": "null" },
              "offset_h": { "type": "null" },
              "non_standard_window": { "const": false }
            }
          }
        },
        {
          "if": {
            "required": ["window_h", "offset_h", "collection_state"],
            "properties": {
              "collection_state": { "const": "collected" },
              "window_h": { "const": 72 },
              "offset_h": { "minimum": -12, "maximum": 12 }
            }
          },
          "then": { "properties": { "within_window": { "const": true } } }
        },
        {
          "if": {
            "required": ["window_h", "offset_h", "collection_state"],
            "properties": {
              "collection_state": { "const": "collected" },
              "window_h": { "const": 72 },
              "offset_h": { "anyOf": [{ "exclusiveMaximum": -12 }, { "exclusiveMinimum": 12 }] }
            }
          },
          "then": { "properties": { "within_window": { "const": false } } }
        },
        {
          "$comment": "재정 P-7: 168h 창은 ±24h 다. 72h 분기와 나란히 양방향으로 건다.",
          "if": {
            "required": ["window_h", "offset_h", "collection_state"],
            "properties": {
              "collection_state": { "const": "collected" },
              "window_h": { "const": 168 },
              "offset_h": { "minimum": -24, "maximum": 24 }
            }
          },
          "then": { "properties": { "within_window": { "const": true } } }
        },
        {
          "if": {
            "required": ["window_h", "offset_h", "collection_state"],
            "properties": {
              "collection_state": { "const": "collected" },
              "window_h": { "const": 168 },
              "offset_h": { "anyOf": [{ "exclusiveMaximum": -24 }, { "exclusiveMinimum": 24 }] }
            }
          },
          "then": { "properties": { "within_window": { "const": false } } }
        },
        {
          "$comment": "보존 표지의 양방향 결속: 창 안 관측은 비표준이 아니고, 창 밖 관측은 반드시 비표준으로 표시된다. 표시 없이 창 밖 기록을 남기면 그 행이 표준 통계에 섞인다.",
          "if": {
            "required": ["collection_state", "within_window"],
            "properties": {
              "collection_state": { "const": "collected" },
              "within_window": { "const": true }
            }
          },
          "then": { "properties": { "non_standard_window": { "const": false } } }
        },
        {
          "if": {
            "required": ["collection_state", "within_window"],
            "properties": {
              "collection_state": { "const": "collected" },
              "within_window": { "const": false }
            }
          },
          "then": { "properties": { "non_standard_window": { "const": true } } }
        }
      ]
    },
    "hook": {
      "$comment": "훅 트윗(T1)의 원시 계측값. 필드는 전부 필수이며, collected 행에서는 전부 정수다. ★ 미수집 행(snapshot.collection_state == \"not-collected\", 재정 P-7)에서만 null 이 허용된다 — 뜨지 않은 관측을 0 으로 적으면 '노출이 0 이었다'는 계측 주장이 되어 원시 전량 보존(규율 (2))의 의미가 뒤집힌다. 두 갈래의 결속은 아래 allOf 의 collection_state 분기가 진다.",
      "type": "object",
      "additionalProperties": false,
      "required": ["impressions", "likes", "reposts", "quotes", "bookmarks", "replies"],
      "properties": {
        "impressions": { "type": ["integer", "null"], "minimum": 0 },
        "likes": { "type": ["integer", "null"], "minimum": 0 },
        "reposts": { "type": ["integer", "null"], "minimum": 0 },
        "quotes": { "type": ["integer", "null"], "minimum": 0 },
        "bookmarks": { "type": ["integer", "null"], "minimum": 0 },
        "replies": { "type": ["integer", "null"], "minimum": 0 }
      }
    },
    "landing": {
      "$comment": "착지 트윗 노출. 완주율 근사의 분자. null 허용 조건은 hook 과 같다(미수집 행 전용).",
      "type": "object",
      "additionalProperties": false,
      "required": ["impressions"],
      "properties": {
        "impressions": { "type": ["integer", "null"], "minimum": 0 }
      }
    },
    "completion_proxy": {
      "$comment": "landing.impressions / hook.impressions. 분모가 0이면 null 이고, 미수집 행(재정 P-7)에서도 null 이다 — 두 null 의 뜻이 다르다는 사실은 snapshot.collection_state 가 구별한다. 음수는 불가능하므로 minimum 0 으로 막는다(M-05c). 산식 일치는 검사 feedback.row-consistency 몫이다.",
      "type": ["number", "null"],
      "minimum": 0
    },
    "context": {
      "type": "object",
      "additionalProperties": false,
      "required": ["posted_at_local", "follower_count", "topic_tags", "series", "series_id"],
      "properties": {
        "posted_at_local": { "type": "string", "minLength": 1 },
        "follower_count": { "type": "integer", "minimum": 0 },
        "topic_tags": { "type": "array", "items": { "type": "string", "minLength": 1 } },
        "series": { "type": "boolean" },
        "series_id": { "type": ["string", "null"] }
      }
    },
    "entered_by": { "const": "owner" },
    "entered_at": { "$ref": "#/$defs/timestamp" }
  },
  "allOf": [
    {
      "$comment": "정정 행은 반드시 원 행을 지목한다.",
      "if": {
        "required": ["entry_kind"],
        "properties": { "entry_kind": { "const": "correction" } }
      },
      "then": {
        "properties": { "corrects": { "$ref": "#/$defs/row_id" } }
      }
    },
    {
      "$comment": "M-05a 집행: 최초 기록 행은 아무 행도 정정하지 않는다. record 행에 살아 있는 corrects 를 달아 정정 관계를 위조하는 경로를 막는다.",
      "if": {
        "required": ["entry_kind"],
        "properties": { "entry_kind": { "const": "record" } }
      },
      "then": {
        "properties": { "corrects": { "type": "null" } }
      }
    },
    {
      "$comment": "재정 P-7 집행 ①: 관측이 있는 행은 계측값이 전부 실수치다. null 은 미수집 행에만 열린다 — 이 분기가 없으면 위에서 넓힌 타입이 collected 행의 계측 누락까지 통과시킨다.",
      "if": {
        "required": ["snapshot"],
        "properties": {
          "snapshot": {
            "required": ["collection_state"],
            "properties": { "collection_state": { "const": "collected" } }
          }
        }
      },
      "then": {
        "properties": {
          "hook": {
            "properties": {
              "impressions": { "type": "integer" },
              "likes": { "type": "integer" },
              "reposts": { "type": "integer" },
              "quotes": { "type": "integer" },
              "bookmarks": { "type": "integer" },
              "replies": { "type": "integer" }
            }
          },
          "landing": { "properties": { "impressions": { "type": "integer" } } }
        }
      }
    },
    {
      "$comment": "재정 P-7 집행 ②: 미수집 행은 계측값을 갖지 않는다 — 전부 null 이고 완주율 근사도 null 이다. 행을 지우는 대신 '뜨지 않았다'를 적는 것이 이 행의 목적이므로, 값 자리에 관측을 흉내 낸 숫자가 들어가면 목적이 무너진다.",
      "if": {
        "required": ["snapshot"],
        "properties": {
          "snapshot": {
            "required": ["collection_state"],
            "properties": { "collection_state": { "const": "not-collected" } }
          }
        }
      },
      "then": {
        "properties": {
          "hook": {
            "properties": {
              "impressions": { "type": "null" },
              "likes": { "type": "null" },
              "reposts": { "type": "null" },
              "quotes": { "type": "null" },
              "bookmarks": { "type": "null" },
              "replies": { "type": "null" }
            }
          },
          "landing": { "properties": { "impressions": { "type": "null" } } },
          "completion_proxy": { "type": "null" }
        }
      }
    }
  ],
  "$defs": {
    "row_id": { "type": "string", "pattern": "^mr-[0-9]{6}$" },
    "timestamp": {
      "type": "string",
      "pattern": "^[0-9]{4}-[0-9]{2}-[0-9]{2}T[0-9]{2}:[0-9]{2}:[0-9]{2}(?:[.][0-9]+)?(?:Z|[+-][0-9]{2}:[0-9]{2})$"
    }
  }
}
